speaker,stage,paragraph,source_file,Sound: Ja/Nein?,Lautstärkeniveau (0;1-5)
DER PRINZ,"sagt  an einem Arbeitstische, voller Briefschaften und Papiere, deren einige er
  durchläuft","Klagen, nichts als Klagen! Bittschriften, nichts als Bittschriften! – Die traurigen Geschäfte; und man beneidet uns noch! – Das glaub' ich; wenn wir allen helfen könnten: dann wären wir zu beneiden. – Emilia?",lessing-emilia-galotti.xml,Ja,
DER KAMMERDIENER,sagt  welcher wieder herein tritt,"Nach dem Marchese ist geschickt. Und hier, ein Brief von der Gräfin Orsina.",lessing-emilia-galotti.xml,Ja,
DER KAMMERDIENER,sagt  der nochmals herein tritt,Der Maler Conti will die Gnade haben – –,lessing-emilia-galotti.xml,Ja,
CONTI,sagt  indem er das andere zurecht stellet,"Ich bitte, Prinz, daß Sie die Schranken unserer Kunst erwägen wollen. Vieles von dem Anzüglichsten der Schönheit liegt ganz außer den Grenzen derselben. – Treten Sie so! –",lessing-emilia-galotti.xml,Ja,
DER PRINZ,sagt nach einer kurzen Betrachtung.,"Vortrefflich, Conti; – ganz vortrefflich! – Das gilt Ihrer Kunst, Ihrem Pinsel. – Aber geschmeichelt, Conti; ganz unendlich geschmeichelt!",lessing-emilia-galotti.xml,Ja,
CONTI,sagt etwas ärgerlich.,"Ah, mein Prinz, – wir Maler rechnen darauf, daß das fertige Bild den Liebhaber noch eben so warm",lessing-emilia-galotti.xml,Ja,
CONTI,"sagt  indem er es holt, und noch verkehrt in der Hand hält",Auch ein weibliches Porträt.,lessing-emilia-galotti.xml,Nein,
DER PRINZ,"sagt  indem er sich zu fassen sucht, aber ohne ein Auge von dem Bilde zu
  verwenden","So halb! – um sie eben wieder zu kennen. – Es ist einige Wochen her, als ich sie mit ihrer Mutter in einer Vegghia traf. – Nachher ist sie mir nur an heiligen Stätten wieder vorgekommen, – wo das Angaffen sich weniger ziemet. – Auch kenn' ich ihren Vater. Er ist mein Freund nicht. Er war es, der sich meinen Ansprüchen auf Sabionetta am meisten widersetzte. – Ein alter Degen; stolz und rauh; sonst bieder und gut! –",lessing-emilia-galotti.xml,Ja,
DER PRINZ,sagt indem er nur eben von dem Bilde wegblickt.,"Was sagen Sie, Conti? Was wollen Sie wissen?",lessing-emilia-galotti.xml,Ja,
DER PRINZ,sagt mit einer erzwungenen Kälte.,"Also, Conti, rechnen Sie doch wirklich Emilia Galotti mit zu den vorzüglichsten Schönheiten unserer Stadt?",lessing-emilia-galotti.xml,Ja,
DER PRINZ,sagt der sich schnell gegen ihn kehret.,"Nun, Conti? ist doch nicht schon versagt?",lessing-emilia-galotti.xml,Ja,
DER PRINZ,sagt  der sich voll Verzweiflung in einen Stuhl wirft,So bin ich verloren! – So will ich nicht leben!,lessing-emilia-galotti.xml,Ja,
DER PRINZ,sagt  der gegen ihn wieder aufspringt,"Verräter! – was mir ist? – Nun ja ich liebe sie; ich bete sie an. Mögt ihr es doch wissen! mögt ihr es doch längst gewußt haben, alle ihr, denen ich der tollen Orsina schimpfliche Fesseln lieber ewig tragen sollte! – Nur daß Sie, Marinelli, der Sie so oft mich Ihrer innigsten Freundschaft versicherten – O ein Fürst hat keinen Freund! kann keinen Freund haben! – daß Sie, Sie, so treulos, so hämisch mir bis auf diesen Augenblick die Gefahr verhöhlen dürfen, die meiner Liebe drohte: wenn ich Ihnen jemals das vergebe, – so werde mir meiner Sünden keine vergeben!",lessing-emilia-galotti.xml,Ja,
CAMILLO ROTA,sagt stutzig und den Prinzen starr ansehend.,"Ein Todesurteil, sagt' ich.",lessing-emilia-galotti.xml,Ja,
CAMILLO ROTA,sagt seine Schriften nachsehend.,"Nun hab' ich es doch wohl nicht mitgenommen! – – Verzeihen Sie, gnädiger Herr. – Es kann Anstand damit haben bis morgen.",lessing-emilia-galotti.xml,Ja,
CAMILLO ROTA,"sagt  den Kopf schüttelnd, indem er die Papiere zu sich nimmt und abgeht","Recht gern? – Ein Todesurteil recht gern? – Ich hätt' es ihn in diesem Augenblicke nicht mögen unterschreiben lassen, und wenn es den Mörder meines einzigen Sohnes betroffen hätte. – Recht gern! recht gern! – Es geht mir durch die Seele dieses gräßliche Recht gern!",lessing-emilia-galotti.xml,Nein,
CLAUDIA,"sagt  im Heraustreten zu Pirro, der von der andern Seite hereintritt",Wer sprengte da in den Hof?,lessing-emilia-galotti.xml,Ja,
ANGELO,"sagt noch halb hinter der Szene, in einem kurzen Mantel, den er über das Gesicht
  gezogen, den Hut in die Stirne.",Pirro! – Pirro!,lessing-emilia-galotti.xml,Ja,
EMILIA,sagt stürzet in einer ängstlichen Verwirrung herein.,Wohl mir! wohl mir! Nun bin ich in Sicherheit. Oder ist er mir gar gefolgt?,lessing-emilia-galotti.xml,Ja,
APPIANI,"sagt  tritt tiefsinnig, mit vor sich hingeschlagnen Augen herein, und kömmt ihnen
  näher, ohne sie zu erblicken; bis Emilia ihm entgegen springt","Ah, meine Teuerste! – Ich war mir Sie in dem Vorzimmer nicht vermutend.",lessing-emilia-galotti.xml,Nein,
APPIANI,sagt nackdenkend und schwermütig.,Bedeuten Tränen – bedeuten Tränen!,lessing-emilia-galotti.xml,Ja,
APPIANI,sagt  indem er ihr mit einer niedergeschlagnen Miene nachsieht,"Perlen bedeuten Tränen! – Eine kleine Geduld! – Ja, wenn die Zeit nur außer uns wäre! – Wenn eine Minute am Zeiger, sich in uns nicht in Jahre ausdehnen könnte! –",lessing-emilia-galotti.xml,Ja,
CLAUDIA,sagt stutzig.,Bei dem Prinzen?,lessing-emilia-galotti.xml,Ja,
APPIANI,sagt nach einiger Überlegung.,Allerdings.,lessing-emilia-galotti.xml,Ja,
MARINELLI,"sagt  der sich losreißt, und abgeht","Nur Geduld, Graf, nur Geduld!",lessing-emilia-galotti.xml,Ja,
CLAUDIA,sagt eiligst und besorgt.,Gott! Herr Graf – Ich hab' einen heftigen Wortwechsel gehört. – Ihr Gesicht glühet. Was ist vorgefallen?,lessing-emilia-galotti.xml,Ja,
DER PRINZ,sagt höhnisch.,"Neugierde zur Gnüge! – Die ich nur befriedigen muß. – O, es ging alles nach Wunsch. – Sie brauchen sich nicht weiter zu bemühen, mein allzudienstfertiger Freund! – Sie kam meinem Verlangen, mehr als halbes Weges, entgegen. Ich hätte sie nur gleich mitnehmen dürfen.",lessing-emilia-galotti.xml,Ja,
MARINELLI,sagt  der wieder nach dem Fenster geht,"Dort fährt der Wagen langsam nach der Stadt zurück. – So langsam? Und in jedem Schlage ein Bedienter? – Das sind Anzeigen, die mir nicht gefallen; – daß der Streich wohl nur halb gelungen ist; – daß man einen Verwundeten gemächlich zurückführet, – und keinen Toten. – Die Maske steigt ab. – Es ist Angelo selbst. Der Tolldreiste! – Endlich, hier weiß er die Schliche. – Er winkt mir zu. Er muß seiner Sache gewiß sein. – Ha, Herr Graf, der Sie nicht nach Massa wollten, und nun noch einen weitern Weg müssen! – Wer hatte Sie die Affen so kennen gelehrt?",lessing-emilia-galotti.xml,Ja,
ANGELO,sagt der die Maske abgenommen.,"Passen Sie auf, Herr Kammerherr! Man muß sie gleich bringen.",lessing-emilia-galotti.xml,Ja,
EMILIA,sagt außer Atem.,"Ah! – Ah! – Ich danke Ihm, mein Freund; – ich dank' Ihm. – Aber Gott, Gott! wo bin ich? – Und so ganz allein? Wo bleibt meine Mutter? Wo blieb der Graf? – Sie kommen doch nach? mir auf dem Fuße nach?",lessing-emilia-galotti.xml,Ja,
MARINELLI,"sagt  der plötzlich herzu tritt, als ob er eben herein käme","Ah, gnädiges Fräulein! Was für ein Unglück, oder vielmehr, was für ein Glück, – was für ein glückliches Unglück verschafft uns die Ehre –",lessing-emilia-galotti.xml,Ja,
EMILIA,sagt stutzend.,"Wie? Sie hier, mein Herr? – Ich bin also wohl bei Ihnen? – Verzeihen Sie, Herr Kammerherr. Wir sind von Räubern ohnfern überfallen worden. Da kamen uns gute Leute zu Hülfe; – und dieser ehrliche Mann hob mich aus dem Wagen, und brachte mich hierher. – Aber ich erschrecke, mich allein gerettet zu sehen. Meine Mutter ist noch in der Gefahr. Hinter uns ward sogar geschossen. Sie ist vielleicht tot; – und ich lebe? – Verzeihen Sie. Ich muß fort; ich muß wieder hin, – wo ich gleich hätte bleiben sollen.",lessing-emilia-galotti.xml,Ja,
EMILIA,sagt äußerst bestürzt.,Der Prinz?,lessing-emilia-galotti.xml,Ja,
EMILIA,sagt unentschlossen.,Aber – wenn ihnen nichts widerfahren – wenn meine Ahnungen mich trügen; – warum sind sie,lessing-emilia-galotti.xml,Ja,
EMILIA,sagt die vor ihm niederfällt.,"Zu Ihren Füßen, gnädiger Herr –",lessing-emilia-galotti.xml,Ja,
DER PRINZ,sagt sie aufhebend.,"Ich bin äußerst beschämt. – Ja, Emilia, ich verdiene diesen stummen Vorwurf. – Mein Betragen diesen Morgen, ist nicht zu rechtfertigen; – zu entschuldigen höchstens. Verzeihen Sie meiner Schwachheit. Ich hätte Sie mit keinem Geständnisse beunruhigen sollen, von dem ich keinen Vorteil zu erwarten habe. Auch ward ich durch die sprachlose Bestürzung, mit der Sie es anhörten, oder vielmehr nicht anhörten, genugsam bestraft. – Und könnt' ich schon diesen Zufall, der mir nochmals, ehe alle meine Hoffnung auf ewig verschwindet, – mir nochmals das Glück Sie zu sehen und zu sprechen verschafft; könnt' ich schon diesen Zufall für den Wink eines günstigen Glückes erklären, – für den wunderbarsten Aufschub meiner endlichen Verurteilung erklären, um nochmals um Gnade flehen zu dürfen: so will ich doch – Beben Sie nicht, mein Fräulein – einzig und allein von Ihrem Blicke abhangen. Kein Wort, kein Seufzer, soll Sie beleidigen. – Nur kränke mich nicht Ihr Mißtrauen. Nur zweifeln Sie keinen Augenblick an der unumschränktesten Gewalt, die Sie über mich haben. Nur falle Ihnen nie bei, daß Sie eines andern Schutzes gegen mich bedürfen. – Und nun kommen Sie, mein Fräulein, – kommen Sie, wo Entzückungen auf Sie warten, die Sie mehr billigen.",lessing-emilia-galotti.xml,Ja,
BATTISTA,sagt eiligst.,"Die Mutter, Herr Kammerherr –",lessing-emilia-galotti.xml,Ja,
CLAUDIA GALOTTI,sagt innerhalb.,"Emilia! Emilia! Mein Kind, wo bist du?",lessing-emilia-galotti.xml,Ja,
CLAUDIA,"sagt  die in die Türe tritt, indem Battista heraus gehen will","Ha! der hob sie aus dem Wagen! Der führte sie fort! Ich erkenne dich. Wo ist sie? Sprich, Unglücklicher!",lessing-emilia-galotti.xml,Ja,
CLAUDIA,sagt bitter und langsam.,"Der Name Marinelli war das letzte Wort des sterbenden Grafen! – Verstehen Sie nun? – Ich verstand es erst auch nicht: ob schon mit einem Tone gesprochen – mit einem Tone! – Ich höre ihn noch! Wo waren meine Sinne, daß sie diesen Ton nicht sogleich verstanden?",lessing-emilia-galotti.xml,Ja,
EMILIA,sagt innerhalb.,"Ha, meine Mutter! Ich höre meine Mutter!",lessing-emilia-galotti.xml,Ja,
DER PRINZ,sagt als aus dem Zimmer von Emilien kommend.,"Kommen Sie, Marinelli! Ich muß mich erholen – und muß Licht von Ihnen haben.",lessing-emilia-galotti.xml,Ja,
DER PRINZ,sagt nachgebend.,"Nun gut, nun gut –",lessing-emilia-galotti.xml,Ja,
MARINELLI,sagt kalt.,Schwerlich.,lessing-emilia-galotti.xml,Ja,
MARINELLI,sagt noch kälter.,Wahrscheinlich genug.,lessing-emilia-galotti.xml,Ja,
MARINELLI,sagt höchst gleichgültig.,Was Sie auch gemußt hätten – wenn der Graf noch lebte. –,lessing-emilia-galotti.xml,Ja,
DER PRINZ,"sagt heftig, aber sich gleich wieder fassend.","Marinelli! – Doch, Sie sollen mich nicht wild machen. – Es sei so – Es ist so! Und das wollen Sie doch nur sagen: der Tod des Grafen ist für mich ein Glück – das größte Glück, was mir begegnen konnte, – das einzige Glück, was meiner Liebe zu statten kommen konnte. Und als dieses, – mag er doch geschehen sein, wie er will! – Ein Graf mehr in der Welt, oder weniger! Denke ich Ihnen so recht? – Topp! auch ich erschrecke vor einem kleinen Verbrechen nicht. Nur, guter Freund, muß es ein kleines stilles Verbrechen, ein kleines heilsames Verbrechen sein. Und sehen Sie, unseres da, wäre nun gerade weder stille noch heilsam. Es hätte den Weg zwar gereiniget, aber zugleich gesperrt. Jedermann würde es uns auf den Kopf zusagen, – und leider hätten wir es gar nicht einmal begangen! – Das liegt doch wohl nur bloß an Ihren weisen, wunderbaren Anstalten?",lessing-emilia-galotti.xml,Ja,
DER PRINZ,sagt sich vor die Stirne schlagend.,Verwünscht!,lessing-emilia-galotti.xml,Ja,
BATTISTA,sagt eiligst.,Eben kömmt die Gräfin an.,lessing-emilia-galotti.xml,Ja,
ORSINA,sagt ohne den Marinelli anfangs zu erblicken.,"Was ist das? – Niemand kömmt mir entgegen, außer ein Unverschämter, der mir lieber gar den Eintritt verweigert hätte? – Ich bin doch zu Dosalo? Zu dem Dosalo, wo mir sonst ein ganzes Heer geschäftiger Augendiener entgegen stürzte? wo mich sonst Liebe und Entzücken erwarteten? – Der Ort ist es; aber, aber! – Sieh' da, Marinelli! – Recht gut, daß der Prinz Sie mitgenommen. – Nein, nicht gut! Was ich mit ihm auszumachen hätte, hätte ich nur mit ihm auszumachen. – Wo ist er?",lessing-emilia-galotti.xml,Ja,
MARINELLI,sagt  der sie zurück hält,Wohin?,lessing-emilia-galotti.xml,Ja,
ORSINA,sagt heftig.,Nicht gelesen? –,lessing-emilia-galotti.xml,Ja,
ORSINA,sagt stolz.,"Verachtung? – Wer denkt daran? – Wem brauchen Sie das zu sagen? – Sie sind ein unverschämter Tröster, Marinelli! – Verachtung! Verachtung! Mich verachtet man auch! mich! –",lessing-emilia-galotti.xml,Ja,
ORSINA,sagt höhnisch.,"Allerdings? – O des weisen Mannes, den man sagen lassen kann, was man will! – Gleichgültigkeit! Gleichgültigkeit an die Stelle der Liebe? – Das heißt, Nichts an die Stelle von Etwas. Denn lernen Sie, nachplauderndes Hofmännchen, lernen Sie von einem Weibe, daß Gleichgültigkeit ein leeres Wort, ein bloßer Schall ist, dem nichts, gar nichts entspricht. Gleichgültig ist die Seele nur gegen das, woran sie nicht denkt; nur gegen ein Ding, das für sie kein Ding ist. Und nur gleichgültig für ein Ding, das kein Ding ist, – das ist so viel, als gar nicht gleichgültig. – Ist dir das zu hoch, Mensch?",lessing-emilia-galotti.xml,Ja,
MARINELLI,sagt vor sich.,"O weh! wie wahr ist es, was ich fürchtete!",lessing-emilia-galotti.xml,Ja,
MARINELLI,sagt vor sich.,Das geht weit! – Aber gnädige Gräfin –,lessing-emilia-galotti.xml,Ja,
DER PRINZ,"sagt  indem er aus dem Kabinette tritt, vor sich",Ich muß ihm zu Hülfe kommen –,lessing-emilia-galotti.xml,Ja,
ORSINA,"sagt  die ihn erblickt, aber unentschlüssig bleibt, ob sie auf ihn zugehen
  soll",Ha! da ist er.,lessing-emilia-galotti.xml,Ja,
DER PRINZ,"sagt  geht quer über den Saal, bei ihr vorbei, nach den andern Zimmern, ohne sich im
  Reden aufzuhalten","Sieh da! unsere schöne Gräfin. – Wie sehr betaure ich, Madame, daß ich mir die Ehre Ihres Besuchs für heute so wenig zu Nutze machen kann! Ich bin beschäftiget. Ich bin nicht allein. – Ein andermal, meine liebe Gräfin! Ein andermal. – Itzt halten Sie länger sich nicht auf. Ja nicht länger! – Und Sie, Marinelli, ich erwarte Sie. –",lessing-emilia-galotti.xml,Ja,
ORSINA,sagt wie betäubt.,Hab' ich? hab' ich wirklich?,lessing-emilia-galotti.xml,Ja,
ORSINA,sagt mit Rührung.,"»Ich bin beschäftiget. Ich bin nicht allein.« Ist das die Entschuldigung ganz, die ich wert bin? Wen weiset man damit nicht ab? Jeden Überlästigen, jeden Bettler. Für mich keine einzige Lüge mehr? Keine einzige kleine Lüge mehr, für mich? – Beschäftiget? womit denn? Nicht allein? wer wäre denn bei ihm? – Kommen Sie, Marinelli; aus Barmherzigkeit, lieber Marinelli! Lügen Sie mir eines auf eigene Rechnung vor. Was kostet Ihnen denn eine Lüge? – Was hat er zu tun? Wer ist bei ihm? – Sagen Sie mir; sagen sie mir, was Ihnen zuerst in den Mund kömmt, – und ich gehe.",lessing-emilia-galotti.xml,Ja,
MARINELLI,sagt vor sich.,"Mit dieser Bedingung, kann ich ihr ja wohl einen Teil der Wahrheit sagen.",lessing-emilia-galotti.xml,Ja,
MARINELLI,sagt vor sich.,Sollte ich ihr schon zu viel gesagt haben?,lessing-emilia-galotti.xml,Ja,
MARINELLI,"sagt  indem er ihn erblicket, vor sich",Nun vollends! der Alte! –,lessing-emilia-galotti.xml,Ja,
MARINELLI,sagt sie bei der Hand nicht unsanft ergreifend.,"Erlauben Sie, daß ich meine Schuldigkeit beobachte. –",lessing-emilia-galotti.xml,Ja,
MARINELLI,"sagt  leise zu dem Obersten, den er bei Seite ziehet","Mein Herr, ich muß Sie hier mit einer Dame lassen, die – der – mit deren Verstande – Sie verstehen mich. Ich sage Ihnen",lessing-emilia-galotti.xml,Ja,
ORSINA,"sagt nach einigem Stillschweigen, unter welchem sie den Obersten mit Mitleid
  betrachtet; so wie er sie, mit einer flüchtigen Neugierde.","Was er Ihnen auch da gesagt hat, unglücklicher Mann! –",lessing-emilia-galotti.xml,Ja,
ODOARDO,"sagt halb vor sich, halb gegen sie.",Unglücklicher?,lessing-emilia-galotti.xml,Ja,
CLAUDIA,"sagt  die im Hereintreten sich umsiehet, und sobald sie ihren Gemahl erblickt, auf ihn
  zuflieget","Erraten! – Ah, unser Beschützer, unser Retter! Bist du da, Odoardo? Bist du da? – Aus ihren Wispern, aus ihren Mienen schloß ich es. – Was soll ich dir sagen, wenn du noch nichts weißt? – Was soll ich dir sagen, wenn du schon alles weißt? – Aber wir sind unschuldig. Ich bin unschuldig. Deine Tochter ist unschuldig. Unschuldig, in allem unschuldig!",lessing-emilia-galotti.xml,Ja,
ODOARDO,sagt der sich bei Erblickung seiner Gemahlin zu fassen gesucht.,"Gut, gut. Sei nur ruhig, nur ruhig, – und antworte mir.",lessing-emilia-galotti.xml,Ja,
ODOARDO,sagt mit einem bittern Lachen.,"Ich wollt' auch nicht, Sie hätten! Um wie vieles nicht!",lessing-emilia-galotti.xml,Ja,
ODOARDO,sagt wild hin und her gehend.,"O, – noch bin ich es auch nicht.",lessing-emilia-galotti.xml,Ja,
DER PRINZ,sagt drohend.,"Nur, Marinelli! –",lessing-emilia-galotti.xml,Ja,
ODOARDO,sagt hitzig.,"Erwägen! erwägen! Ich erwäge, daß hier nichts zu erwägen ist. – Sie soll, sie muß mit mir.",lessing-emilia-galotti.xml,Ja,
ODOARDO,sagt gegen Marinelli.,"Nun, mein Herr?",lessing-emilia-galotti.xml,Ja,
ODOARDO,sagt höhnisch.,Nicht? wirklich nicht?,lessing-emilia-galotti.xml,Ja,
ODOARDO,sagt bitter.,Ei! ein Nebenbuhler?,lessing-emilia-galotti.xml,Ja,
DER PRINZ,sagt schmeichelhaft auf ihn zutretend.,"Fassen Sie sich, lieber Galotti –",lessing-emilia-galotti.xml,Ja,
ODOARDO,"sagt  bei Seite, indem er die Hand leer wieder heraus zieht",Das sprach sein Engel!,lessing-emilia-galotti.xml,Ja,
ODOARDO,sagt der in tiefen Gedanken gestanden.,"Wie? so soll ich sie gar nicht sprechen meine Tochter? Auch hier nicht? – Ich lasse mir ja alles gefallen; ich finde ja alles ganz vortrefflich. Das Haus eines Kanzlers ist natürlicher Weise eine Freistatt der Tugend. O, gnädiger Herr, bringen Sie ja meine Tochter dahin; nirgends anders als dahin. – Aber sprechen wollt' ich sie doch gern vorher. Der Tod des Grafen ist ihr noch unbekannt. Sie wird nicht begreifen können, warum man sie von ihren Eltern trennet. Ihr jenen auf gute Art beizubringen; sie dieser Trennung wegen zu beruhigen; – muß ich sie sprechen, gnädiger Herr, muß ich sie sprechen.",lessing-emilia-galotti.xml,Ja,
ODOARDO GALOTTI,sagt ihm nachsehend; nach einer Pause.,Warum nicht? – Herzlich gern – Ha! ha! ha! –,lessing-emilia-galotti.xml,Ja,
DER PRINZ,sagt im Hereintreten.,Was ist das? – Ist Emilien nicht wohl?,lessing-emilia-galotti.xml,Ja,
DER PRINZ,sagt  indem er näher kömmt,Was seh' ich? – Entsetzen!,lessing-emilia-galotti.xml,Ja,
DER PRINZ,"sagt nach einigem Stillschweigen, unter welchem er den Körper mit Entsetzen und
  Verzweiflung betrachtet, zu Marinelli.",Hier! heb' ihn auf. – Nun? Du bedenkst dich? – Elender! –,lessing-emilia-galotti.xml,Ja,